{
  "id": "l0_python_basics",
  "title": "Python 基础",
  "description": "面向零基础学习者的 Python 入门课程，涵盖变量、数据类型、控制流与函数四大核心概念，帮助你建立编程的第一块基石。",
  "level": "l0",
  "icon": "🐍",
  "order": 0,
  "modules": [
    {
      "id": "l0_m1_variables",
      "courseId": "l0_python_basics",
      "title": "第一章 变量与数据类型",
      "description": "从变量与赋值出发，掌握 Python 的基本数据类型和类型转换。",
      "lessons": [
        {
          "id": "l0_m1_l1",
          "moduleId": "l0_m1_variables",
          "title": "变量与赋值",
          "description": "理解变量的概念、命名规则和赋值操作。",
          "knowledgePoints": [
            {
              "id": "l0_m1_l1_kp1",
              "lessonId": "l0_m1_l1",
              "title": "变量与赋值",
              "difficulty": 1,
              "estimatedMinutes": 8,
              "prerequisites": [],
              "coreExplanation": "变量是存储数据的容器，用 `=` 赋值。Python 是动态类型语言，变量无需提前声明类型，解释器会在运行时自动推断。",
              "whyItMatters": "变量是编程的基础，所有数据操作都通过变量进行。理解变量的赋值与命名规则，才能后续处理运算、函数参数与数据结构。",
              "vocabulary": [
                {"term": "变量 (variable)", "definition": "用于存储数据值的命名容器，可通过变量名引用其内容。"},
                {"term": "赋值 (assignment)", "definition": "通过 `=` 将右侧的值绑定到左侧变量名的过程。"},
                {"term": "动态类型 (dynamic typing)", "definition": "变量类型在运行时确定，同一变量可在不同时刻绑定不同类型的值。"}
              ],
              "quiz": [
                {
                  "question": "下列哪个是合法的变量名？",
                  "type": "singleChoice",
                  "options": ["1name", "name_1", "class", "name-1"],
                  "correctAnswerIndices": [1],
                  "explanation": "变量名必须以字母或下划线开头，不能以数字开头；`class` 是关键字；`name-1` 含连字符会被解析为减法。"
                },
                {
                  "question": "`x = 5` 中，`=` 是什么操作？",
                  "type": "singleChoice",
                  "options": ["等于比较", "赋值", "声明", "计算"],
                  "correctAnswerIndices": [1],
                  "explanation": "`=` 是赋值运算符，将 5 赋给变量 x；`==` 才是等于比较。"
                },
                {
                  "question": "Python 中查看变量类型的函数是 ____",
                  "type": "fillInBlank",
                  "options": [],
                  "correctAnswerIndices": [],
                  "correctAnswerText": "type",
                  "explanation": "`type(x)` 返回变量 x 的类型，例如 `<class 'int'>`。"
                }
              ],
              "socraticSeedQuestion": "你能告诉我，为什么 Python 不需要像 Java 那样提前声明变量类型吗？",
              "relatedTopics": ["数据类型", "运算符", "命名规范"],
              "commonMisconceptions": [
                "变量名可以以数字开头（错误，必须以字母或下划线开头）",
                "= 是比较运算符（错误，= 是赋值，== 才是比较）"
              ]
            },
            {
              "id": "l0_m1_l1_kp2",
              "lessonId": "l0_m1_l1",
              "title": "变量命名规范",
              "difficulty": 1,
              "estimatedMinutes": 6,
              "prerequisites": ["l0_m1_l1_kp1"],
              "coreExplanation": "Python 变量命名遵循 snake_case（蛇形命名），即全小写字母用下划线连接。好的变量名应有描述性，如 `student_name` 而非 `x`。常量通常全大写如 `MAX_SIZE`。",
              "whyItMatters": "统一的命名规范让代码更易读，也是团队协作的基础。PEP 8 是 Python 社区公认的代码风格指南。",
              "vocabulary": [
                {"term": "snake_case", "definition": "用下划线连接单词的命名风格，如 my_variable，是 Python 变量/函数的标准命名方式。"},
                {"term": "PEP 8", "definition": "Python 官方代码风格指南，定义了缩进、命名、导入等编码约定。"},
                {"term": "关键字 (keyword)", "definition": "Python 保留的特殊单词（如 if/for/class），不可用作变量名。"}
              ],
              "quiz": [
                {
                  "question": "下列哪个命名风格符合 Python 规范？",
                  "type": "singleChoice",
                  "options": ["myVariable", "MyVariable", "my_variable", "myvariable"],
                  "correctAnswerIndices": [2],
                  "explanation": "Python 变量和函数使用 snake_case 风格，即 my_variable。camelCase 是 Java/JS 风格。"
                },
                {
                  "question": "Python 中常量通常用什么命名方式？",
                  "type": "singleChoice",
                  "options": ["snake_case", "UPPER_SNAKE_CASE", "camelCase", "PascalCase"],
                  "correctAnswerIndices": [1],
                  "explanation": "常量用全大写下划线分隔，如 MAX_RETRY_COUNT，虽然 Python 不强制，但这是约定。"
                },
                {
                  "question": "以下哪些是 Python 关键字？（多选）",
                  "type": "multipleChoice",
                  "options": ["if", "print", "while", "len"],
                  "correctAnswerIndices": [0, 2],
                  "explanation": "if 和 while 是关键字；print 和 len 是内置函数，不是关键字。"
                }
              ],
              "socraticSeedQuestion": "为什么给变量取一个有意义的名字比取 a、b、c 更重要？你能想到一个实际例子吗？",
              "relatedTopics": ["PEP 8 规范", "代码可读性", "注释"],
              "commonMisconceptions": [
                "Python 强制命名规范（错误，PEP 8 是约定而非语法规则）",
                "print 是关键字（错误，print 是内置函数，可以被覆盖）"
              ]
            }
          ],
          "order": 1
        },
        {
          "id": "l0_m1_l2",
          "moduleId": "l0_m1_variables",
          "title": "数据类型",
          "description": "掌握 Python 的基本数据类型及其操作。",
          "knowledgePoints": [
            {
              "id": "l0_m1_l2_kp1",
              "lessonId": "l0_m1_l2",
              "title": "数值类型：int 与 float",
              "difficulty": 1,
              "estimatedMinutes": 8,
              "prerequisites": ["l0_m1_l1_kp1"],
              "coreExplanation": "Python 基本数值类型：int(整数)支持任意精度，float(浮点数)用于表示小数。两者可混合运算，结果自动提升为 float。",
              "whyItMatters": "数值运算是编程最基础的操作。理解 int 与 float 的区别能避免精度问题和类型错误。",
              "vocabulary": [
                {"term": "整数 (int)", "definition": "不带小数点的数字，如 3、-7、0。Python 整数支持任意精度。"},
                {"term": "浮点数 (float)", "definition": "带小数点的数字，如 3.14、-0.5。用 IEEE 754 双精度表示。"},
                {"term": "类型提升", "definition": "int 与 float 混合运算时，int 自动转为 float 参与计算。"}
              ],
              "quiz": [
                {
                  "question": "`type(3.14)` 返回什么？",
                  "type": "singleChoice",
                  "options": ["int", "float", "str", "double"],
                  "correctAnswerIndices": [1],
                  "explanation": "3.14 含小数点，是浮点数 float；Python 中没有 double 类型。"
                },
                {
                  "question": "`5 / 2` 的结果是？",
                  "type": "singleChoice",
                  "options": ["2", "2.5", "2.0", "报错"],
                  "correctAnswerIndices": [1],
                  "explanation": "Python 3 中 `/` 是真除法，5/2 = 2.5；整除用 `//`。"
                },
                {
                  "question": "Python 中整除运算符是 ____",
                  "type": "fillInBlank",
                  "options": [],
                  "correctAnswerIndices": [],
                  "correctAnswerText": "//",
                  "explanation": "`//` 是整除（地板除），如 7//2 = 3。"
                }
              ],
              "socraticSeedQuestion": "为什么 0.1 + 0.2 在 Python 中不等于 0.3？这和浮点数的存储方式有什么关系？",
              "relatedTopics": ["运算符", "类型转换", "math 模块"],
              "commonMisconceptions": [
                "Python 中 / 是整除（错误，/ 是真除法，// 才是整除）",
                "浮点数是精确的（错误，浮点数有精度限制）"
              ]
            },
            {
              "id": "l0_m1_l2_kp2",
              "lessonId": "l0_m1_l2",
              "title": "字符串基础",
              "difficulty": 1,
              "estimatedMinutes": 10,
              "prerequisites": ["l0_m1_l1_kp1"],
              "coreExplanation": "字符串(str)是由字符组成的不可变序列，用单引号或双引号包裹。支持拼接(+)、重复(*)、索引([0])、切片([1:3])等操作。f-string 是格式化字符串的现代方式。",
              "whyItMatters": "字符串处理是最常见的编程任务之一。从用户输入到文件处理，几乎所有程序都涉及字符串操作。",
              "vocabulary": [
                {"term": "字符串 (str)", "definition": "由字符组成的不可变序列，用引号包裹，如 'hello'。"},
                {"term": "索引 (index)", "definition": "通过位置访问序列元素，从 0 开始计数，如 s[0] 取第一个字符。"},
                {"term": "f-string", "definition": "格式化字符串字面量，在字符串前加 f，用 {} 嵌入表达式，如 f'Hello {name}'。"}
              ],
              "quiz": [
                {
                  "question": "下列哪个是字符串？",
                  "type": "singleChoice",
                  "options": ["hello", "\"hello\"", "'hello'", "B和C都对"],
                  "correctAnswerIndices": [3],
                  "explanation": "字符串既可用双引号也可用单引号包裹，裸写的 hello 是变量名而非字符串。"
                },
                {
                  "question": "`'hello'[1]` 的结果是？",
                  "type": "singleChoice",
                  "options": ["h", "e", "l", "报错"],
                  "correctAnswerIndices": [1],
                  "explanation": "索引从 0 开始，[0]是'h'，[1]是'e'。"
                },
                {
                  "question": "`'hi' * 3` 的结果是 ____",
                  "type": "fillInBlank",
                  "options": [],
                  "correctAnswerIndices": [],
                  "correctAnswerText": "hihihi",
                  "explanation": "字符串乘以整数表示重复该字符串若干次。"
                }
              ],
              "socraticSeedQuestion": "字符串为什么被设计成不可变的？如果可以修改字符串中的单个字符，会带来什么问题？",
              "relatedTopics": ["字符串方法", "正则表达式", "编码"],
              "commonMisconceptions": [
                "字符串只能用双引号（错误，单引号也可以）",
                "字符串可以修改单个字符（错误，str 是不可变类型）"
              ]
            },
            {
              "id": "l0_m1_l2_kp3",
              "lessonId": "l0_m1_l2",
              "title": "布尔类型与类型转换",
              "difficulty": 2,
              "estimatedMinutes": 8,
              "prerequisites": ["l0_m1_l2_kp1", "l0_m1_l2_kp2"],
              "coreExplanation": "布尔类型(bool)只有 True 和 False 两个值，是 int 的子类。Python 中任何对象都可以转换为布尔值：0、空字符串、空列表等为 False，其余为 True。类型转换使用 int()、float()、str()、bool() 等函数。",
              "whyItMatters": "布尔值是条件判断的基础，理解真值测试规则能写出更简洁的代码。类型转换是数据处理中必不可少的技能。",
              "vocabulary": [
                {"term": "布尔 (bool)", "definition": "表示真假的数据类型，只有 True 与 False，是 int 的子类。"},
                {"term": "真值测试 (truthy/falsy)", "definition": "Python 中任何对象都可参与布尔判断：0、None、空容器为 falsy，其余为 truthy。"},
                {"term": "类型转换 (type casting)", "definition": "用 int()、str() 等函数将数据从一种类型转换为另一种类型。"}
              ],
              "quiz": [